{"deferred_components":[],"harness_identity":"co-author-harness","manifest_type":"verifier_semantics","members":[{"evidence_type":"governing_policy","path":"references/policies/draft_governance.v1.json","sha256":"28ad3437578468d847116744199e762d870b99ac914ee9faf170b9bc33b6b23d"},{"evidence_type":"schema","path":"references/schemas/assignment_dispatch_claim.schema.json","sha256":"25bbc81456d092a87131ba10aad12e0f8c93d937deee31009d104b39e1dfea17"},{"evidence_type":"schema","path":"references/schemas/assignment_dispatch_consumption.schema.json","sha256":"435c7c8718d16af31dc020017e5e19e9bd7fa6268873024265dd3f8bcc55e8eb"},{"evidence_type":"schema","path":"references/schemas/assignment_dispatch_issuance.schema.json","sha256":"b150c9f5e0494bd84c4731642045974609b599b328c28ef9847b4a6ea42d39a6"},{"evidence_type":"schema","path":"references/schemas/assignment_dispatch_kernel_authorization.schema.json","sha256":"3d37d9d7781ad703d0998d265a86818d0bfd13b41a2f2bdfa9b59c67295d6941"},{"evidence_type":"schema","path":"references/schemas/assignment_host_attestation.schema.json","sha256":"f9ea3cb8f4310ff0a842863739e8a252faaf43026dce1b897ca042271d3bf7cf"},{"evidence_type":"schema","path":"references/schemas/assignment_mutation_anchor.schema.json","sha256":"1b77ca752aaf11e31aaf0d37e6f79b255fb7b509d921449f491293bb83212f91"},{"evidence_type":"schema","path":"references/schemas/assignment_mutation_genesis.schema.json","sha256":"3d70a65d28d47431e31e3465d21c27ed41959b4adf11221b44c7b5a1d1c823b6"},{"evidence_type":"schema","path":"references/schemas/assignment_mutation_state.schema.json","sha256":"317404d51494cd1201f1cd4c30972899b20619509e1be09e1298243e52a1a9bb"},{"evidence_type":"schema","path":"references/schemas/canonical_bibliography_snapshot.schema.json","sha256":"e1a268fa9f89d0e135481b128cfda4c5227d014590617e8dd2363d103e1da7d0"},{"evidence_type":"schema","path":"references/schemas/canonical_extract_receipt.schema.json","sha256":"def4982dafa438a43d93cc2ec17dff8fd1065d0125863c6014aa1bf1a8145cb5"},{"evidence_type":"schema","path":"references/schemas/centroid_semantic_execution.schema.json","sha256":"fc9171b788b473efc4ec76985d8c2aac1530483300c3fda38ffa8665dee4fd1f"},{"evidence_type":"schema","path":"references/schemas/centroid_semantic_execution.v3.schema.json","sha256":"c533e83d0be758649cfd178f0fe5fd0cb2d7b43bc5332472a56ce2c6c98d826c"},{"evidence_type":"schema","path":"references/schemas/evidence_publication_claim.schema.json","sha256":"a84e78c0815d75183c9928bb1211f014aa8dc9fcfc0186091097f41a201ceb37"},{"evidence_type":"schema","path":"references/schemas/evidence_publication_journal.schema.json","sha256":"b24eb155816c62de6e0a23e8f23feb3c09211984f1b1a8ad1dbc4052a804754e"},{"evidence_type":"schema","path":"references/schemas/lifecycle_verifier_binding.schema.json","sha256":"bf191ba767f6ae74dfc32b477f02ff1f4cadbab962ebbe3e48c1fa3932e5d5ff"},{"evidence_type":"schema","path":"references/schemas/product_assurance.schema.json","sha256":"a10b8cf9857b4c787e5881381751192f14802af88c95c27db8995c5a219b8db9"},{"evidence_type":"schema","path":"references/schemas/product_assurance.v2.schema.json","sha256":"6d9415adb619e6cf93676aeb333ca70386cdee27eb1e48c18df7adf4c9817a9f"},{"evidence_type":"schema","path":"references/schemas/semantics_manifest.schema.json","sha256":"c8405570791fc39260d8d78c74f5b7e332c3edbba9e447f1779b6460c27e64a9"},{"evidence_type":"schema","path":"references/schemas/verifier_blocker.schema.json","sha256":"cbe1ddb007e6efe2a0827d4c473f6641fedc9f9ab67c2443d4011676b3b470a7"},{"evidence_type":"schema","path":"references/schemas/verifier_commit_marker.schema.json","sha256":"e2bbf719f2f46df6767e2b26e4f13773e6fa6460f26ef0e8360db24af2bd6bdf"},{"evidence_type":"schema","path":"references/schemas/verifier_publication_manifest.schema.json","sha256":"5187cd64f4a8489de8ee71faf87ffbfed632d946b96260e369b516f44f34cd93"},{"evidence_type":"schema","path":"references/schemas/verifier_transaction.schema.json","sha256":"0b3e46d338c41d983af32ad5090a0f48da413fc73c984d077c1a305104cb21a8"},{"evidence_type":"claim_validator","path":"scripts/assignment_dispatch_claim.py","sha256":"27f56cab1194ed0533f771bd191a49a8396936c41e8587fcd046ffa48e5c357d"},{"evidence_type":"mutation_authority","path":"scripts/assignment_mutation_anchor.py","sha256":"7d98411f84172fe7519f08d4427fd5fa8be16b456912d71ffbc12ed4df41e350"},{"evidence_type":"transaction_kernel","path":"scripts/assignment_receipt_transaction.py","sha256":"1702605e5e4387457f9f124c30545d2653a16943910dddb15e71149064fa0499"},{"evidence_type":"bibliography_coverage_validator","path":"scripts/bibliography_review.py","sha256":"a83fe9830ff912a67d1dbad5a216d767a0442c79b969b75f15214e544ce17cf9"},{"evidence_type":"evidence_validator","path":"scripts/c2_evidence_validation.py","sha256":"32b35303580dc5858d0f3c636624c60654c32aaa0cacefb7d0344592c84a426f"},{"evidence_type":"metadata_resolver","path":"scripts/canonical_bibliography.py","sha256":"e314d6736a80b8d895af44737fe6cbcdea1cf576a436552ee75fb0fe2271b2e1"},{"evidence_type":"destination_authority","path":"scripts/destination_capability.py","sha256":"7697378cbb44b5782d7ecd72672659c3f6033fa9a8dafa79c2dcdbac1ddae892"},{"evidence_type":"shared_verifier","path":"scripts/draft_evidence_verifier.py","sha256":"1f2200b566f5eb5f93e92a07f8c267f9172633eed1df2788126eec12caec45b1"},{"evidence_type":"publication_recovery","path":"scripts/evidence_publication.py","sha256":"35d553c02dea509d78605a60e266bcaad02e2ae7ee75b594e83d03b44877931a"},{"evidence_type":"product_kernel","path":"scripts/product_assurance.py","sha256":"25745b7e8889bae4c0f646eb31af8631350889aa278c52c69d3737646fe38a96"},{"evidence_type":"reader_policy_resolver","path":"scripts/reader_accessibility_policy.py","sha256":"95ad81239ce4dadb075afda7b7f3123890c5306881677b312f7ee70e420a431a"},{"evidence_type":"extractor_adapter","path":"scripts/source_extract.py","sha256":"d235b45a84fc39321912496f09f2e469d1b52f611c15ab87da065983991ce5f5"}],"schema_version":"1.0.0"}
